Name,Date & Time,Location,Type,Region,Latitude,Longitude,weather,temperature,wind_speed,wind_direction
Origami Ghosts,1/2/2025,Sunset Tavern,Music,Fremont / Ballard,,,Cloudy,45,1 mph,N
Good Luck Club,1/3/2025,High Dive,Music,Fremont / Ballard,,,Cloudy,45,1 mph,N
Mary Ann Peters: the edge becomes the center,Now through 1/5/2025,Frye Art Museum,Museums,Capitol Hill / Central District,,,Cloudy,45,1 mph,N
Jacob Lawrence: American Storyteller,Now through 1/5/2025,Seattle Art Museum,Museums,Downtown,,,Cloudy,45,1 mph,N
Stone Images XIV,Now through 1/5/2025,Pacific Bonsai Museum,Museums,South,,,Cloudy,45,1 mph,N
Marvel Studios’ Black Panther in Concert with the Seattle Symphony,1/3/2025 through 1/5/2025,Benaroya Hall,Music,Downtown,,,Cloudy,45,1 mph,N
Black Flag,1/7/2025,El Corazon,Music,Downtown,,,Cloudy,45,1 mph,N
Matt Shevrin and the Jazz French Horn All-Stars,1/8/2025,The Royal Room,Music,South Seattle,,,Cloudy,45,1 mph,N
Monet X Change,1/9/2025,The Neptune Theatre,Theatre,University District,,,Cloudy,45,1 mph,N
CymaticZ,1/10/2025,Barboza,Music,Capitol Hill / Central District,,,Cloudy,45,1 mph,N
Beethoven Symphony No. 7,1/9/2025 through 1/11/2025,Benaroya Hall,Music,Downtown,,,Cloudy,45,1 mph,N
Kimberly Akimbo,1/7/2025 through 1/12/2025,The Paramount Theatre,Theatre,Downtown,,,Cloudy,45,1 mph,N
Les Troyens in Concert,1/17/2025 through 1/19/2025,Marion Oliver McCaw Hall,Music,Queen Anne / Seattle Center,,,Cloudy,45,1 mph,N
Home Beyond Earth,Now through 1/20/2025,The Museum of Flight,Museums,South Seattle,,,Cloudy,45,1 mph,N
Joyce J. Scott: Walk a Mile in My Dreams,Now through 1/20/2025,Seattle Art Museum,Museums,Downtown,,,Cloudy,45,1 mph,N
Les Ballets Trockadero de Monte Carlo,1/23/2025 through 1/25/2025,Meany Center for the Performing Arts,Dance,University District,,,Cloudy,45,1 mph,N
Christine Sun Kim: Ghost(ed) Notes,Now through 1/26/2025,Henry Art Gallery,Museums,University District,,,Cloudy,45,1 mph,N
Fischersund: Faux Flora,Now through 1/26/2025,National Nordic Museum,Museums,Fremont / Ballard,,,Cloudy,45,1 mph,N
Midori Plays Brahms,1/23/2025 through 1/26/2025,Benaroya Hall,Music,Downtown,,,Cloudy,45,1 mph,N
Auburn Symphony: Soulful Serenade,1/26/2025,Auburn Performing Arts Center,Music,South,,,Cloudy,45,1 mph,N
Kodo One Earth Tour: Warabe,1/31/2025,Meany Center for the Performing Arts,Music,University District,,,Cloudy,45,1 mph,N
Hayv Kahraman: Look Me in the Eyes,Now through 2/2/2025,Frye Art Museum,Museums,Capitol Hill / Central District,,,Cloudy,45,1 mph,N
Ravel Mother Goose,1/30/2025 through 2/2/2025,Benaroya Hall,Music,Downtown,,,Cloudy,45,1 mph,N
Rep 3: The Sleeping Beauty,1/31/2025 through 2/9/2025,Marion Oliver McCaw Hall,Dance,Queen Anne / Seattle Center,,,Cloudy,45,1 mph,N
Conrad Tao and Caleb Teicher,2/14/2025,Meany Center for the Performing Arts,Music,University District,,,Cloudy,45,1 mph,N
Amjad Ali Khan and Sons,2/21/2025,Meany Center for the Performing Arts,Music,University District,,,Cloudy,45,1 mph,N
"Hello Auntie, Hello Uncle: Conversations with Our Elders",Now through 2/23/2025,Wing Luke Museum,Museums,International District,,,Cloudy,45,1 mph,N
Blues for an Alabama Sky,1/30/2025 through 2/23/2025,Seattle Rep,Theatre,Queen Anne / Seattle Center,,,Cloudy,45,1 mph,N
Isidore String Quartet: Unrequited,2/25/2025,Meany Center for the Performing Arts,Music,University District,,,Cloudy,45,1 mph,N
Ronald K. Brown/EVIDENCE,2/27/2025 through 3/1/2025,Meany Center for the Performing Arts,Dance,University District,,,Cloudy,45,1 mph,N
Auburn Symphony: The Magical Music of Harry Potter,3/1/2025,Federal Way Performing Arts and Event Center,Music,South,,,Cloudy,45,1 mph,N
Meot: Korean Art from the Frank Bayley Collection,Now through 3/2/2025,Seattle Art Museum,Museums,Downtown,,,Cloudy,45,1 mph,N
Hamilton,2/4/2025 through 3/2/2025,The Paramount Theatre,Theatre,Downtown,,,Cloudy,45,1 mph,N
Covenant,2/5/2025 through 3/2/2025,ArtsWest Playhouse and Gallery,Theatre,West Seattle,,,Cloudy,45,1 mph,N
The Magic Flute,2/22/2025 through 3/9/2025,Marion Oliver McCaw Hall,Music,Queen Anne / Seattle Center,,,Cloudy,45,1 mph,N
The Last Five Years,2/8/2025 through 3/16/2025,ACT Theatre,Theatre,Downtown,,,Cloudy,45,1 mph,N
The Last Five Years,2/8/2025 through 3/16/2025,ACT Theatre,Theatre,Downtown,,,Cloudy,45,1 mph,N
Jeremy Denk,3/18/2025,Meany Center for the Performing Arts,Music,University District,,,Cloudy,45,1 mph,N
Rep 4: Emergence,3/14/2025 through 3/23/2025,Marion Oliver McCaw Hall,Dance,Queen Anne / Seattle Center,,,Cloudy,45,1 mph,N
2025 NCAA Division I Men’s Basketball First + Second Rounds,3/21/2025 through 3/23/2025,Climate Pledge Arena,Sports,Queen Anne / Seattle Center,,,Cloudy,45,1 mph,N
Silkroad Ensemble: Uplifted Voices,3/28/2025,Meany Center for the Performing Arts,Music,University District,,,Cloudy,45,1 mph,N
Waitress,3/11/2025 through 3/30/2025,The 5th Avenue Theatre,Theatre,Downtown,,,Cloudy,45,1 mph,N
Gone to Soon: Nabilah Ahmed,Now through 3/31/2025,MoPOP Museum of Pop Culture,Museums,Queen Anne / Seattle Center,,,Cloudy,45,1 mph,N
Alonzo King LINES Ballet: Deep River,4/3/2025 through 4/5/2025,Meany Center for the Performing Arts,Dance,University District,,,Cloudy,45,1 mph,N
Boren Banner Series: Natalie Krick,Now through 4/6/2025,Frye Art Museum,Museums,Capitol Hill / Central District,,,Cloudy,45,1 mph,N
Mother Russia (or Periods of Collapse),3/6/2025 through 4/6/2025,Seattle Rep,Theatre,Queen Anne / Seattle Center,,,Cloudy,45,1 mph,N
Leyla McCalla: Black Banjo,4/12/2025,Meany Center for the Performing Arts,Music,University District,,,Cloudy,45,1 mph,N
Rep 5: Romeo et Juliette,4/11/2025 through 4/20/2025,Marion Oliver McCaw Hall,Dance,Queen Anne / Seattle Center,,,Cloudy,45,1 mph,N
Life of Pi,4/15/2025 through 4/20/2025,The Paramount Theatre,Theatre,Downtown,,,Cloudy,45,1 mph,N
Frederick Ballentine in Concert,4/27/2025,Marion Oliver McCaw Hall,Music,Queen Anne / Seattle Center,,,Cloudy,45,1 mph,N
Untamed: The Anatomy of Desire,Now through 4/30/2025,Museum of Glass,Museums,South,,,Cloudy,45,1 mph,N
DADS,4/24/2025 through 5/3/2025,Washington Ensemble Theatre,Theatre,Capitol Hill / Central District,,,Cloudy,45,1 mph,N
Third Coast Percussion and Jessie Montgomery,5/3/2025,Meany Center for the Performing Arts,Music,University District,,,Cloudy,45,1 mph,N
Gwendolyn Knight and Jacob Lawrence Prize Winner: Bethany Collins,Now through 5/4/2025,Seattle Art Museum,Museums,Downtown,,,Cloudy,45,1 mph,N
Athena,4/10/2025 through 5/4/2025,ArtsWest Playhouse and Gallery,Theatre,West Seattle,,,Cloudy,45,1 mph,N
Parade,4/16/2025 through 5/4/2025,The 5th Avenue Theatre,Theatre,Downtown,,,Cloudy,45,1 mph,N
Anne-Karin Furunes,2/14/2025 through 5/5/2025,National Nordic Museum,Museums,Fremont / Ballard,,,Cloudy,45,1 mph,N
Complexions Contemporary Ballet,5/8/2025 through 5/10/2025,Meany Center for the Performing Arts,Dance,University District,,,Cloudy,45,1 mph,N
Laughs in Spanish,4/17/2025 through 5/11/2025,Seattle Rep,Theatre,Queen Anne / Seattle Center,,,Cloudy,45,1 mph,N
Golden,4/26/2025 through 5/11/2025,ACT Theatre,Theatre,Downtown,,,Cloudy,45,1 mph,N
Six,5/6/2025 through 5/11/2025,The Paramount Theatre,Theatre,Downtown,,,Cloudy,45,1 mph,N
Jonathan Biss Transfiguration,5/13/2025,Meany Center for the Performing Arts,Music,University District,,,Cloudy,45,1 mph,N
Tosca,5/3/2025 through 5/17/2025,Marion Oliver McCaw Hall,Music,Queen Anne / Seattle Center,,,Cloudy,45,1 mph,N
Hamid Rahmanian’s Song of the North,5/17/2025,Meany Center for the Performing Arts,Theatre,University District,,,Cloudy,45,1 mph,N
Recent Acquisitions,Now through 6/1/2025,Frye Art Museum,Museums,Capitol Hill / Central District,,,Cloudy,45,1 mph,N
Riverdance,5/30/2025 through 6/1/2025,The Paramount Theatre,Dance,Downtown,,,Cloudy,45,1 mph,N
Rep 6: Director’s Choice,5/30/2025 through 6/8/2025,Marion Oliver McCaw Hall,Dance,Queen Anne / Seattle Center,,,Cloudy,45,1 mph,N
Mamma Mia!,6/10/2025 through 6/15/2025,The Paramount Theatre,Theatre,Downtown,,,Cloudy,45,1 mph,N
Dual Reality,5/29/2025 through 6/22/2025,Seattle Rep,Theatre,Queen Anne / Seattle Center,,,Cloudy,45,1 mph,N
Bye Bye Birdie,6/10/2025 through 6/29/2025,The 5th Avenue Theatre,Theatre,Downtown,,,Cloudy,45,1 mph,N
The Effect,6/19/2025 through 7/13/2025,ArtsWest Playhouse and Gallery,Theatre,West Seattle,,,Cloudy,45,1 mph,N
& Juliet,7/29/2025 through 8/3/2025,The Paramount Theatre,Theatre,Downtown,,,Cloudy,45,1 mph,N
After Midnight,8/5/2025 through 8/24/2025,The 5th Avenue Theatre,Theatre,Downtown,,,Cloudy,45,1 mph,N
Nancy Callan: Forces at Play,Now through 8/31/2025,Museum of Glass,Museums,South,,,Cloudy,45,1 mph,N
Field Notes: Artists Observe Nature,Now through 8/31/2025,Museum of Glass,Museums,South,,,Cloudy,45,1 mph,N
"The Maestro in Series: Explorations of Form, Color, and Technique",5/15/2025 through 10/31/2025,Museum of Glass,Museums,South,,,Cloudy,45,1 mph,N
Diego Cibelli: Fiori dei mei Habiti,Now through 5/10/2026,Seattle Art Museum,Museums,Downtown,,,Cloudy,45,1 mph,N
Diego Cibelli,Now through 5/10/2026,Seattle Art Museum,Museums,Downtown,,,Cloudy,45,1 mph,N
Explore The Market,Ongoing,Pike Place Market,Festivals & Special Events,Downtown,,,Cloudy,45,1 mph,N
Olympic Sculpture Park,Ongoing,Olympic Sculpture Park,Visual Arts & Galleries,Downtown,,,Cloudy,45,1 mph,N
Infinite Worlds of Science Fiction,Ongoing,MoPOP Museum of Pop Culture,Museums,Queen Anne / Seattle Center,,,Cloudy,45,1 mph,N
"Wild Blue Angel: Hendrix Abroad, 1966-70",Ongoing,MoPOP Museum of Pop Culture,Museums,Queen Anne / Seattle Center,,,Cloudy,45,1 mph,N
John Grade: Middle Fork,Ongoing,Seattle Art Museum,Museums,Downtown,,,Cloudy,45,1 mph,N
Scared to Death: The Thrill of Horror Film,Ongoing,MoPOP Museum of Pop Culture,Museums,Queen Anne / Seattle Center,,,Cloudy,45,1 mph,N
Nirvana: Taking Punk To the Masses,Ongoing,MoPOP Museum of Pop Culture,Museums,Queen Anne / Seattle Center,,,Cloudy,45,1 mph,N
Vietnam Divided: War Above Southeast Asia,Ongoing,The Museum of Flight,Museums,South Seattle,,,Cloudy,45,1 mph,N
Science Fiction and Fantasy Hall of Fame,Ongoing,MoPOP Museum of Pop Culture,Museums,Queen Anne / Seattle Center,,,Cloudy,45,1 mph,N
Honoring Our Journey,Ongoing,Wing Luke Museum,Museums,International District,,,Cloudy,45,1 mph,N
Great Hall of Washington History,Ongoing,Washington State History Museum,Museums,South,,,Cloudy,45,1 mph,N
Humboldt Penguin Exhibit,Ongoing,Woodland Park Zoo,Museums,Wallingford / Greenlake,,,Cloudy,45,1 mph,N
Giant Pacific Octopus,Ongoing,Seattle Aquarium,Museums,Downtown,,,Cloudy,45,1 mph,N
Meet our Marine Mammals,Ongoing,Seattle Aquarium,Museums,Downtown,,,Cloudy,45,1 mph,N
Window on Washington Waters,Ongoing,Seattle Aquarium,Museums,Downtown,,,Cloudy,45,1 mph,N
Guitar Gallery,Ongoing,MoPOP Museum of Pop Culture,Museums,Queen Anne / Seattle Center,,,Cloudy,45,1 mph,N
Nordic Journeys,Ongoing,National Nordic Museum,Museums,Fremont / Ballard,,,Cloudy,45,1 mph,N
Baird’s beaked whale,Ongoing,Burke Museum,Museums,University District,,,Cloudy,45,1 mph,N
Amazing Life,Ongoing,Burke Museum,Museums,University District,,,Cloudy,45,1 mph,N
Culture is Living,Ongoing,Burke Museum,Museums,University District,,,Cloudy,45,1 mph,N
Fossils Uncovered,Ongoing,Burke Museum,Museums,University District,,,Cloudy,45,1 mph,N
Northwest Native Art,Ongoing,Burke Museum,Museums,University District,,,Cloudy,45,1 mph,N
Our Material World,Ongoing,Burke Museum,Museums,University District,,,Cloudy,45,1 mph,N
Apollo,Ongoing,The Museum of Flight,Museums,South Seattle,,,Cloudy,45,1 mph,N
Art and Life Along the Northwest Coast,Ongoing,Seattle Art Museum,Museums,Downtown,,,Cloudy,45,1 mph,N
Washington: My Home,Ongoing,Washington State History Museum,Museums,South,,,Cloudy,45,1 mph,N
Sensory-Friendly Programs,Ongoing,MoPOP Museum of Pop Culture,Festivals & Special Events,Queen Anne / Seattle Center,,,Cloudy,45,1 mph,N
Dale Chihuly at Tacoma Art Museum,Ongoing,Tacoma Art Museum,Museums,South,,,Cloudy,45,1 mph,N
Porcelain Room,Ongoing,Seattle Art Museum,Museums,Downtown,,,Cloudy,45,1 mph,N
Life on the Edge,Ongoing,Seattle Aquarium,Museums,Downtown,,,Cloudy,45,1 mph,N
Tropical Pacific,Ongoing,Seattle Aquarium,Museums,Downtown,,,Cloudy,45,1 mph,N
Underwater Dome,Ongoing,Seattle Aquarium,Museums,Downtown,,,Cloudy,45,1 mph,N
Meet the Animals,Ongoing,Woodland Park Zoo,Museums,Wallingford / Greenlake,,,Cloudy,45,1 mph,N
Chihuly Garden and Glass,Ongoing,Chihuly Garden and Glass,Museums,Queen Anne / Seattle Center,,,Cloudy,45,1 mph,N
Discover Ancient Coast Salish Culture,Ongoing,Hibulb Cultural Center,Museums,North,,,Cloudy,45,1 mph,N
Savor Seattle Signature Tour: Pike Place Market,Ongoing,Pike Place Market,Tours & Attractions,Downtown,,,Cloudy,45,1 mph,N
Untold Stories: World War II at 75,Ongoing,The Museum of Flight,Museums,South Seattle,,,Cloudy,45,1 mph,N
Bezos Center for Innovation,Ongoing,Museum of History & Industry,Museums,Queen Anne / Seattle Center,,,Cloudy,45,1 mph,N
Maritime Seattle,Ongoing,Museum of History & Industry,Museums,Queen Anne / Seattle Center,,,Cloudy,45,1 mph,N
True Northwest: The Seattle Journey,Ongoing,Museum of History & Industry,Museums,Queen Anne / Seattle Center,,,Cloudy,45,1 mph,N
Metaphor into Form: Art in the Era of the Pilchuck Glass School,Ongoing,Tacoma Art Museum,Museums,South,,,Cloudy,45,1 mph,N
Winter in the West,Ongoing,Tacoma Art Museum,Museums,South,,,Cloudy,45,1 mph,N
Ballard Farmers Market – Sunday,Ongoing,Ballard Farmers Market,Festivals & Special Events,Fremont / Ballard,,,Cloudy,45,1 mph,N
Capitol Hill Farmers Market – Sunday,Ongoing,Capitol Hill Farmers Market,Festivals & Special Events,Capitol Hill / Central District,,,Cloudy,45,1 mph,N
University District Farmers Market,Ongoing,University District Farmers Market,Festivals & Special Events,University District,,,Cloudy,45,1 mph,N
Fremont Sunday Market,Ongoing,Fremont Farmers Market,Festivals & Special Events,Fremont / Ballard,,,Cloudy,45,1 mph,N
Chihuly Garden and Glass Gallery Talks & Tours,Ongoing,Chihuly Garden and Glass,Tours & Attractions,Queen Anne / Seattle Center,,,Cloudy,45,1 mph,N
Boundless: Stories of Asian Art,Ongoing,Seattle Asian Art Museum,Museums,Capitol Hill / Central District,,,Cloudy,45,1 mph,N
Kenzan Tsutakawa-Chinn: Gather,Ongoing,Seattle Asian Art Museum,Museums,Capitol Hill / Central District,,,Cloudy,45,1 mph,N
Art Walk Edmonds | Every Third Thursday,Ongoing,Cascadia Art Museum,Visual Arts & Galleries,North,,,Cloudy,45,1 mph,N
Show Me Seattle Tours,Ongoing,"Seattle, WA",Tours & Attractions,Downtown,,,Cloudy,45,1 mph,N
LeMay – America’s Car Museum,Ongoing,LeMay - America's Car Museum,Museums,South,,,Cloudy,45,1 mph,N
History Link Tours,Ongoing,"Seattle, WA",Tours & Attractions,Downtown,,,Cloudy,45,1 mph,N
West Seattle Farmers Market – Sundays,Ongoing,West Seattle Farmers Market,Festivals & Special Events,West Seattle,,,Cloudy,45,1 mph,N
REMEMBRANCE: The Legacy of Executive Order 9066 in Washington State,Ongoing,Washington State History Museum,Museums,South,,,Cloudy,45,1 mph,N
Pioneer Square First Thursday Art Walk,Ongoing,Pioneer Square,Visual Arts & Galleries,Pioneer Square,,,Cloudy,45,1 mph,N
Deities and Demons: Supernatural in Japanese Art,Ongoing,Seattle Art Museum,Museums,Downtown,,,Cloudy,45,1 mph,N
American Art: The Stories We Carry,Ongoing,Seattle Art Museum,Museums,Downtown,,,Cloudy,45,1 mph,N
Manazma Sheen,Ongoing,Sea Monster Lounge,Music,Wallingford / Greenlake,,,Cloudy,45,1 mph,N
Massive: The Power of Pop Culture,Ongoing,MoPOP Museum of Pop Culture,Museums,Queen Anne / Seattle Center,,,Cloudy,45,1 mph,N
Yirrkala: Art from Australia’s Top End,Ongoing,Seattle Art Museum,Museums,Downtown,,,Cloudy,45,1 mph,N
Earthlings and Extraterrestrials: 20 Years of Kids Design Glass,Ongoing,Museum of Glass,Museums,South,,,Cloudy,45,1 mph,N
